{
  "schemaVersion": "five_layer_snapshot.v1",
  "modelLayer": {
    "fit": "sufficient",
    "notes": [
      "The model can reason about UI structure, frontend planning, and tradeoffs."
    ]
  },
  "harnessLayer": {
    "fit": "partial",
    "requiredControls": [
      "Clarity Gate",
      "Experience Review",
      "Final Report"
    ]
  },
  "promptLayer": {
    "fit": "partial",
    "requiredViews": [
      "Product goal",
      "UX",
      "UI",
      "Frontend implementation"
    ]
  },
  "skillLayer": {
    "fit": "partial",
    "availableTools": [
      "repository read",
      "frontend file editing"
    ],
    "missingTools": [
      "visual screenshot verification, if implementation is required"
    ]
  },
  "ragMemoryLayer": {
    "fit": "unknown",
    "requiredContext": [
      "existing design system",
      "target users",
      "frontend stack"
    ],
    "missingContext": [
      "brand constraints",
      "current UI conventions"
    ]
  }
}